{
  "schemaVersion": 1,
  "contractVersion": 1,
  "languageId": "javascript",
  "title": "JavaScript 코딩테스트",
  "problems": [
    {
      "id": "coding-test-javascript-target-words",
      "slug": "count-target-words",
      "revision": 1,
      "order": 1,
      "lessonId": "js-04-collections",
      "conceptIds": ["js.arrays", "js.builtins"],
      "difficulty": "beginner",
      "type": "string",
      "tags": ["문자열", "분리", "카운팅"],
      "estimatedMinutes": 15,
      "title": "목표 단어 세기",
      "summary": "공백으로 구분된 문장에서 대소문자를 무시하고 목표 단어의 등장 횟수를 셉니다.",
      "description": "`countTargetWords(text, target)` 함수를 작성하세요. `text`를 공백 문자로 나눈 단어 중 `target`과 대소문자를 무시하고 정확히 같은 단어의 개수를 반환합니다. 다른 단어 안에 포함된 부분 문자열은 세지 않습니다.",
      "functionContract": {
        "parameters": [
          {
            "name": "text",
            "type": "string",
            "description": "영문자와 공백 문자로 이루어진 길이 0 이상 1,000 이하의 문자열입니다."
          },
          {
            "name": "target",
            "type": "string",
            "description": "공백이 없는 영문 단어이며 길이는 1 이상 30 이하입니다."
          }
        ],
        "returns": {
          "type": "integer",
          "description": "대소문자를 무시했을 때 target과 정확히 같은 단어의 수입니다."
        },
        "constraints": [
          "단어는 하나 이상의 공백 문자로 구분됩니다.",
          "대소문자는 구분하지 않습니다.",
          "부분 문자열 일치는 단어 일치로 세지 않습니다."
        ],
        "complexity": {
          "time": "O(n)",
          "space": "O(n)"
        }
      },
      "entryPoint": "countTargetWords",
      "starterCode": "function countTargetWords(text, target) {\n  // 문장을 단어 단위로 나눈 뒤 target과 비교하세요.\n  return 0;\n}\n",
      "examples": [
        {
          "args": ["Code learn code", "code"],
          "expected": 2,
          "explanation": "Code와 code는 대소문자를 무시하면 모두 목표 단어와 같습니다."
        }
      ],
      "publicTests": [
        {
          "id": "words-empty-text",
          "label": "빈 문장",
          "args": ["", "js"],
          "expected": 0
        },
        {
          "id": "words-basic-repeat",
          "label": "같은 단어가 두 번 등장",
          "args": ["Code learn code", "code"],
          "expected": 2
        },
        {
          "id": "words-ignore-case",
          "label": "대소문자가 다른 같은 단어",
          "args": ["JS js Js", "js"],
          "expected": 3
        },
        {
          "id": "words-repeated-whitespace",
          "label": "앞뒤와 단어 사이에 여러 공백",
          "args": ["  build   test build  ", "build"],
          "expected": 2
        },
        {
          "id": "words-substring-trap",
          "label": "다른 단어 안의 부분 문자열",
          "args": ["cat scatter cat", "cat"],
          "expected": 2
        },
        {
          "id": "words-target-absent",
          "label": "목표 단어가 없는 문장",
          "args": ["arrays and objects", "function"],
          "expected": 0
        }
      ],
      "runTestIds": ["words-basic-repeat", "words-ignore-case", "words-substring-trap"],
      "failureExplanations": [
        {
          "testId": "words-empty-text",
          "message": "빈 문장은 단어를 하나 가진 배열이 아니라 목표 단어가 0번 등장한 경우입니다."
        },
        {
          "testId": "words-basic-repeat",
          "message": "문장의 모든 단어를 끝까지 순회하며 같은 단어를 누적했는지 확인하세요."
        },
        {
          "testId": "words-ignore-case",
          "message": "문장 단어와 목표 단어를 같은 대소문자 형태로 바꾼 뒤 비교하세요."
        },
        {
          "testId": "words-repeated-whitespace",
          "message": "하나 이상의 연속된 공백을 하나의 단어 구분으로 처리해야 합니다."
        },
        {
          "testId": "words-substring-trap",
          "message": "문자열 내부 포함 여부가 아니라 분리된 단어 전체가 같은지 비교하세요."
        },
        {
          "testId": "words-target-absent",
          "message": "일치하는 단어가 없으면 누적값 0을 그대로 반환해야 합니다."
        }
      ]
    },
    {
      "id": "coding-test-javascript-inventory-summary",
      "slug": "summarize-inventory",
      "revision": 1,
      "order": 2,
      "lessonId": "js-04-collections",
      "conceptIds": ["js.arrays", "js.objects"],
      "difficulty": "beginner",
      "type": "object",
      "tags": ["배열", "객체", "누적"],
      "estimatedMinutes": 20,
      "title": "재고 수량 요약하기",
      "summary": "재고 항목을 순회해 카테고리별 수량을 하나의 객체로 누적합니다.",
      "description": "`summarizeInventory(items)` 함수를 작성하세요. 각 항목의 `category`와 `quantity`를 읽어 food, book, tool 세 카테고리의 총수량을 반환합니다. 항목이 없거나 특정 카테고리가 없어도 세 키를 모두 포함해야 합니다.",
      "functionContract": {
        "parameters": [
          {
            "name": "items",
            "type": "{ category: \"food\" | \"book\" | \"tool\", quantity: integer }[]",
            "description": "길이 0 이상 100 이하인 재고 항목 배열입니다."
          }
        ],
        "returns": {
          "type": "{ food: integer, book: integer, tool: integer }",
          "description": "세 카테고리의 수량 합계를 담은 객체입니다."
        },
        "constraints": [
          "quantity는 0 이상 100 이하인 정수입니다.",
          "같은 카테고리가 여러 번 나오면 수량을 모두 더합니다.",
          "반환 객체는 food, book, tool 키를 항상 포함합니다."
        ],
        "complexity": {
          "time": "O(n)",
          "space": "O(1)"
        }
      },
      "entryPoint": "summarizeInventory",
      "starterCode": "function summarizeInventory(items) {\n  const totals = { food: 0, book: 0, tool: 0 };\n\n  // 각 항목의 카테고리에 수량을 누적하세요.\n\n  return totals;\n}\n",
      "examples": [
        {
          "args": [[{"category": "food", "quantity": 2}, {"category": "tool", "quantity": 4}, {"category": "book", "quantity": 1}, {"category": "tool", "quantity": 3}]],
          "expected": {"food": 2, "book": 1, "tool": 7},
          "explanation": "tool 항목 두 개의 수량 4와 3을 더하고 food와 book도 각각 누적합니다."
        }
      ],
      "publicTests": [
        {
          "id": "inventory-empty",
          "label": "재고 항목이 없는 경우",
          "args": [[]],
          "expected": {"food": 0, "book": 0, "tool": 0}
        },
        {
          "id": "inventory-single-category",
          "label": "카테고리 하나만 있는 경우",
          "args": [[{"category": "book", "quantity": 3}]],
          "expected": {"food": 0, "book": 3, "tool": 0}
        },
        {
          "id": "inventory-duplicate-category",
          "label": "같은 카테고리가 반복되는 경우",
          "args": [[{"category": "food", "quantity": 2}, {"category": "food", "quantity": 5}]],
          "expected": {"food": 7, "book": 0, "tool": 0}
        },
        {
          "id": "inventory-mixed-duplicates",
          "label": "여러 카테고리와 중복 항목",
          "args": [[{"category": "food", "quantity": 2}, {"category": "tool", "quantity": 4}, {"category": "book", "quantity": 1}, {"category": "tool", "quantity": 3}]],
          "expected": {"food": 2, "book": 1, "tool": 7}
        },
        {
          "id": "inventory-zero-quantity",
          "label": "수량이 0인 항목",
          "args": [[{"category": "food", "quantity": 0}, {"category": "book", "quantity": 2}]],
          "expected": {"food": 0, "book": 2, "tool": 0}
        },
        {
          "id": "inventory-maximum-total",
          "label": "같은 카테고리의 최대 수량 누적",
          "args": [[{"category": "tool", "quantity": 100}, {"category": "tool", "quantity": 100}, {"category": "tool", "quantity": 100}]],
          "expected": {"food": 0, "book": 0, "tool": 300}
        }
      ],
      "runTestIds": ["inventory-empty", "inventory-duplicate-category", "inventory-mixed-duplicates"],
      "failureExplanations": [
        {
          "testId": "inventory-empty",
          "message": "항목이 없어도 세 카테고리 키가 0인 초기 객체를 반환해야 합니다."
        },
        {
          "testId": "inventory-single-category",
          "message": "현재 항목의 category를 반환 객체의 키로 사용했는지 확인하세요."
        },
        {
          "testId": "inventory-duplicate-category",
          "message": "이전 합계를 덮어쓰지 말고 현재 quantity를 더해야 합니다."
        },
        {
          "testId": "inventory-mixed-duplicates",
          "message": "각 카테고리가 서로 독립적인 누적값을 유지하는지 확인하세요."
        },
        {
          "testId": "inventory-zero-quantity",
          "message": "0도 유효한 수량이며 다른 카테고리의 누적에 영향을 주지 않아야 합니다."
        },
        {
          "testId": "inventory-maximum-total",
          "message": "같은 카테고리가 여러 번 반복되어도 모든 수량을 빠짐없이 누적해야 합니다."
        }
      ]
    },
    {
      "id": "coding-test-javascript-increasing-run",
      "slug": "longest-increasing-run",
      "revision": 1,
      "order": 3,
      "lessonId": "js-04-collections",
      "conceptIds": ["js.arrays"],
      "difficulty": "beginner",
      "type": "array",
      "tags": ["배열", "연속 구간", "상태"],
      "estimatedMinutes": 20,
      "title": "가장 긴 연속 증가 구간",
      "summary": "배열에서 바로 이전 값보다 엄격히 커지는 가장 긴 연속 구간의 길이를 찾습니다.",
      "description": "`longestIncreasingRun(values)` 함수를 작성하세요. 인접한 다음 값이 바로 이전 값보다 클 때만 같은 증가 구간입니다. 같거나 작아지면 새 구간이 시작됩니다. 부분 수열이 아니라 원래 배열에서 서로 붙어 있는 구간을 평가합니다.",
      "functionContract": {
        "parameters": [
          {
            "name": "values",
            "type": "integer[]",
            "description": "길이 0 이상 100 이하이며 각 값이 -1,000 이상 1,000 이하인 정수 배열입니다."
          }
        ],
        "returns": {
          "type": "integer",
          "description": "가장 긴 연속 증가 구간의 길이이며 빈 배열이면 0입니다."
        },
        "constraints": [
          "증가는 다음 값이 이전 값보다 엄격히 큰 경우입니다.",
          "같은 값이 연속되면 증가 구간이 끊깁니다.",
          "빈 배열은 0을 반환합니다."
        ],
        "complexity": {
          "time": "O(n)",
          "space": "O(1)"
        }
      },
      "entryPoint": "longestIncreasingRun",
      "starterCode": "function longestIncreasingRun(values) {\n  if (values.length === 0) return 0;\n\n  // 현재 구간 길이와 지금까지의 최댓값을 갱신하세요.\n  return 1;\n}\n",
      "examples": [
        {
          "args": [[1, 4, 2, 3, 5, 0]],
          "expected": 3,
          "explanation": "연속 구간 [2, 3, 5]의 길이 3이 가장 깁니다."
        }
      ],
      "publicTests": [
        {
          "id": "run-empty-array",
          "label": "빈 배열",
          "args": [[]],
          "expected": 0
        },
        {
          "id": "run-single-value",
          "label": "값이 하나인 배열",
          "args": [[7]],
          "expected": 1
        },
        {
          "id": "run-all-increasing",
          "label": "전체가 증가하는 배열",